{
  "schemaVersion": 1,
  "status": "approved",
  "operation": "publication",
  "target": "github-release",
  "release": "1.0.0",
  "releaseRef": "v1.0.0-rc.2",
  "sourceCommit": "c9775788367476067a27b07dcaa0c78a01364750",
  "scope": [
    "release-assets/checksums.txt",
    "release-assets/dist.tar.gz",
    "release-assets/manifest.json",
    "release-assets/reports.tar.gz"
  ],
  "task": "TASK-2026-020",
  "approvedBy": {
    "name": "Quentin",
    "role": "Repository owner"
  },
  "approvedAt": "2026-06-11T02:26:57Z",
  "expiresAt": "2026-06-18T02:26:57Z"
}
